{
	"asset": {
		"referenceFilename": "abc",
		"schemaVersion": 1
	},
	"bibliographic": {
		"primaryID": "abc123",
		"classmark": "*ABC 123",
		"formerClassmark": "*NCOW 123",
		"nonCMSID": "string123",
		"cmsItemID": 123456,
		"cmsCollectionID": "string123",
		"catalogBNumber": "B12345678",
		"mssID": 12345,
		"barcode": 33433123456789,
		"mmsCollectionID": "12345678-1234-1234-1234-123456789abc",
		"divisionCode": "MYH",
		"vernacularDivisionCode": "Dance",
		"projectCode": "projectXYZ",
		"title": "Audio Cassette 1",
		"date": "Late 1970s",
		"contentNotes": "media is actually Dance Audio 2 instead of Dance Audio 1"
	},
	"technical": {
		"filename": "abc123",
		"extension": "wav",
		"dateCreated": "2016-01-01",
		"fileFormat": "WAV file",
		"fileCodec": "PCM",
		"fileSize": 123456789012,
		"durationMilli": 3600000,
		"durationHuman": "1:00:00.000",
		"signalNotes": "signal undreadable at point 123"
	},
	"source": {
		"object": {
			"type": "audio analog cassette",
			"format": "cassette",
			"generation": "unknown",
			"volumeNumber": 1
		},
		"subObject": {
			"faceNumber": 2,
			"regionNumber": 1,
			"streamNumber": 1,
			"partNumber": 1
		},
		"stock": {
			"stockLength": {
				"measure": 60,
				"unit": "min"
			},
			"stockManufacturer": "Manufacturer A",
			"stockProductID": "idabc123",
			"tapeWidth": {
				"measure": 0.25,
				"unit": "in"
			},
			"tapeThickness": {
				"measure": 240,
				"unit": "mils"
			},
			"baseMaterial": "polyester",
			"oxideMaterial": "ferrichrome",
			"backcoatMaterial": "yes"
		},
		"audioRecording": {
			"audioSoundField": "quadrophonic",
			"numberOfAudioTracks": 4,
			"trackConfiguration": "full-track",
			"designatedSpeed": {
				"measure": 0.9375,
				"unit": "ips"
			},
			"designatedNoiseReduction": "Dolby B",
			"designatedEQ": "Type II"
		},
		"notes": {
			"physicalConditionPreShipNotes": "cassette XYZ damage",
			"physicalConditionDigitizationNotes": "tape shows ABC damage"
		}
	},
	"digitizationProcess": {
		"playbackDevice": {
			"serialNumber": "xyz123",
			"manufacturer": "Manufacturer B",
			"model": "Model XYZ",
			"tapeHeadType": "full-track",
			"noiseReduction": "Dolby B",
			"eq": "Type II",
			"speed": {
				"measure": 0.9375,
				"unit": "ips"
			}
		},
		"captureSoftware": {
			"manufacturer": "Manufacturer E",
			"productName": "Product XYZ",
			"version": "Version 123",
			"platform": "OS XYZ"
		},
		"notes": {
			"processNotes": "required intervention for reason xyz"
		}
	},
	"digitizer": {
		"operator": {
			"firstName": "Doe",
			"lastName": "Jane"
		},
		"organization": {
			"name": "Organization XYZ",
			"addressStreet1": "123 ABC St",
			"addressStreet2": "Suite 1234",
			"addressCity": "Anytown",
			"addressState": "ST",
			"addressPostalCode": 12345
		}
	}
}
