{
	"asset": {
		"referenceFilename": "abc",
		"schemaVersion": 1
	},
	"bibliographic": {
		"primaryID": "abc123",
		"classmark": "*ABC 123",
		"formerClassmark": "*NCOW 123",
		"nonCMSID": "string123",
		"cmsItemID": 123456,
		"cmsCollectionID": "string123",
		"catalogBNumber": "B12345678",
		"mssID": 12345,
		"barcode": 33433123456789,
		"divisionCode": "MYH",
		"vernacularDivisionCode": "Dance",
		"projectCode": "projectXYZ",
		"title": "Dance Audio 1",
		"date": "Late 1970s",
		"contentNotes": "media is actually Dance Audio 2 instead of Dance Audio 1"
	},
	"technical": {
		"filename": "abc123",
		"extension": "wav",
		"dateCreated": "2016-01-01",
		"fileFormat": "WAV file",
		"fileCodec": "PCM",
		"fileSize": 123456789012,
		"durationMilli": 3600000,
		"durationHuman": "1:00:00.000",
		"signalNotes": "signal undreadable at point 123"
	},
	"source": {
		"object": {
			"type": "audio optical disc",
			"format": "CD-R",
			"generation": 2,
			"volumeNumber": 1
		},
		"subObject": {
			"faceNumber": 1,
			"regionNumber": 1,
			"streamNumber": 1,
			"partNumber": 1
		},
		"physicalDescription": {
			"stockManufacturer": "Manufacturer A",
			"discDiameter": {
				"measure": 4.7,
				"unit": "in"
			},
			"dyeLayer": "phthalocyanine",
			"reflectiveLayer": "silver"
		},
		"audioRecording": {
			"audioSoundField": "stereo"
		},
		"notes": {
			"physicalConditionPreShipNotes": "disc shows XYZ damage",
			"physicalConditionDigitizationNotes": "medium shows ABC damage"
		}
	},
	"digitizationProcess": {
		"playbackDevice": {
			"serialNumber": "xyz123",
			"manufacturer": "Manufacturer B",
			"model": "Model XYZ"
		},
		"captureSoftware": {
			"manufacturer": "Manufacturer E",
			"productName": "Product XYZ",
			"version": "Version 123",
			"platform": "OS XYZ"
		},
		"notes": {
			"processNotes": "required intervention for reason xyz"
		}
	},
	"digitizer": {
		"operator": {
			"firstName": "Doe",
			"lastName": "Jane"
		},
		"organization": {
			"name": "Organization XYZ",
			"addressStreet1": "123 ABC St",
			"addressStreet2": "Suite 1234",
			"addressCity": "Anytown",
			"addressState": "ST",
			"addressPostalCode": 12345
		}
	}
}
