{
	"asset": {
		"referenceFilename": "abc",
		"schemaVersion": 1
	},
	"bibliographic": {
		"primaryID": "abc123",
		"classmark": "*ABC 123",
		"formerClassmark": "*NCOW 123",
		"nonCMSID": "string123",
		"cmsItemID": 123456,
		"cmsCollectionID": "string123",
		"catalogBNumber": "B12345678",
		"mssID": 12345,
		"barcode": 33433123456789,
		"mmsCollectionID": "12345678-1234-1234-1234-123456789abc",
		"divisionCode": "MYH",
		"vernacularDivisionCode": "Dance",
		"projectCode": "projectXYZ",
		"title": "Dance Video 1",
		"date": "Late 1970s",
		"contentNotes": "media is actually Dance Video 2 instead of Dance Video 1"
	},
	"technical": {
		"filename": "abc123",
		"extension": "mov",
		"dateCreated": "2016-01-01",
		"fileFormat": "MOV file",
		"fileCodec": "4cc",
		"fileSize": 123456789012,
		"durationMilli": 3600000,
		"durationHuman": "11:54:54.999",
		"signalNotes": "signal undreadable at point 123"
	},
	"source": {
		"object": {
			"type": "audio reel",
			"format": "1/4 inch open reel audio",
			"generation": "unknown",
			"volumeNumber": 1
		},
		"subObject": {
			"faceNumber": 2,
			"regionNumber": 2,
			"streamNumber": 1,
			"partNumber": 1
		},
		"stock": {
			"reelDiameter": {
				"measure": 7,
				"unit": "in"
			},
			"stockManufacturer": "Manufacturer A",
			"stockProductID": "idabc123",
			"tapeWidth": {
				"measure": 0.25,
				"unit": "in"
			},
			"tapeThickness": {
				"measure": 240,
				"unit": "mils"
			},
			"baseMaterial": "acetate",
			"oxideMaterial": "chromium dioxide",
			"backcoatMaterial": "yes"
		},
		"audioRecording": {
			"audioSoundField": "quadrophonic",
			"numberOfAudioTracks": 24,
			"trackConfiguration": "full-track",
			"designatedSpeed": {
				"measure": 7.5,
				"unit": "ips"
			},
			"designatedNoiseReduction": "DBX II",
			"designatedEQ": "NAB"
		},
		"notes": {
			"physicalConditionPreShipNotes": "reel show XYZ damage",
			"physicalConditionDigitizationNotes": "tape shows XYZ damage"
		}
	},
	"digitizationProcess": {
		"playbackDevice": {
			"serialNumber": "xyz123",
			"manufacturer": "Manufacturer B",
			"model": "Model XYZ",
			"tapeHeadType": "full-track",
			"operatingLevel": {
				"measure": 315,
				"unit": "nW/m"
			},
			"noiseReduction": "DBX II",
			"eq": "NAB",
			"speed": {
				"measure": 7.5,
				"unit": "ips"
			}
		},
		"captureSoftware": {
			"manufacturer": "Manufacturer E",
			"productName": "Product XYZ",
			"version": "Version 123",
			"platform": "OS XYZ"
		},
		"notes": {
			"processNotes": "required two takes for reason xyz"
		}
	},
	"digitizer": {
		"operator": {
			"firstName": "Doe",
			"lastName": "Jane"
		},
		"organization": {
			"name": "Organization XYZ",
			"addressStreet1": "123 ABC St",
			"addressStreet2": "Suite 1234",
			"addressCity": "Anytown",
			"addressState": "ST",
			"addressZip": 12345
		}
	}
}
