{
	"asset": {
		"referenceFilename": "abc",
		"schemaVersion": 1
	},
	"bibliographic": {
		"primaryID": "abc123",
		"classmark": "*ABC 123",
		"formerClassmark": "*NCOW 123",
		"nonCMSID": "string123",
		"cmsItemID": 123456,
		"cmsCollectionID": "string123",
		"catalogBNumber": "B12345678",
		"mssID": 12345,
		"barcode": 33433123456789,
		"divisionCode": "MYH",
		"vernacularDivisionCode": "Dance",
		"projectCode": "projectXYZ",
		"title": "Dance Video 1",
		"date": "Late 1970s",
		"contentNotes": "media is actually Dance Video 2 instead of Dance Video 1"
	},
	"technical": {
		"filename": "abc123",
		"extension": "mov",
		"dateCreated": "2016-01-01",
		"fileFormat": "MOV file",
		"fileCodec": "v210",
		"fileSize": 123456789012,
		"durationMilli": 3600000,
		"durationHuman": "1:00:00.000",
		"signalNotes": "signal undreadable at point 123"
	},
	"source": {
		"object": {
			"type": "video cassette",
			"format": "3/4 inch U-matic",
			"volumeNumber": 1
		},
		"subObject": {
			"faceNumber": 1,
			"regionNumber": 1,
			"partNumber": 1
		},
		"physicalDescription": {
			"stockLength": {
				"measure": 60,
				"unit": "min"
			},
			"stockManufacturer": "Sony",
			"stockProductID": "KCA-60",
			"tapeWidth": {
				"measure": 0.75,
				"unit": "in"
			},
			"baseMaterial": "polyester",
			"oxideMaterial": "ferric oxide"
		},
		"contentSpecifications": {
			"broadcastStandard": "SECAM",
			"colorBW": "b/w"
		},
		"audioRecording": {
			"audioSoundField": "mono",
			"numberOfAudioTracks": 1
		},
		"notes": {
			"physicalConditionPreShipNotes": "cassette shows XYZ damage",
			"physicalConditionDigitizationNotes": "tape shows ABC damage"
		}
	},
	"digitizationProcess": {
		"playbackDevice": {
			"serialNumber": "xyz123",
			"manufacturer": "Manufacturer B",
			"model": "Model XYZ"
		},
		"timeBaseCorrector": {
			"id": "id12345",
			"serialNumber": 12345,
      "manufacturer": "Manufacturer C",
      "model": "Model XYZ"
		},
		"analogDigitalConverter" : {
      "id": "id12345",
      "serialNumber": "id12345abc",
      "manufacturer": "Manufacturere D",
      "model": "Model XYZ"
		},
		"analogDigitalConverter": {
			"serialNumber": "xyz123",
			"manufacturer": "Manufacturer D",
			"model": "Model XYZ"
		},
		"captureSoftware": {
			"manufacturer": "Manufacturer E",
			"productName": "Product XYZ",
			"version": "Version 123",
			"platform": "OS XYZ"
		},
		"notes": {
			"processNotes": "required intervention for reason xyz"
		}
	},
	"digitizer": {
		"operator": {
			"firstName": "Doe",
			"lastName": "Jane"
		},
		"organization": {
			"name": "Organization XYZ",
			"addressStreet1": "123 ABC St",
			"addressStreet2": "Suite 1234",
			"addressCity": "Anytown",
			"addressState": "ST",
			"addressPostalCode": "12345"
		}
	}
}
